title,publisher,author,yearMachine Learning with Python: A Step by Step Guide for Absolute Beginners to Program Artificial Intelligence with Python. Neural Networks and Data Science from Pre-Processing to Deep Learning,nan,"CODING, MARK",2020
Data Science at the Command Line,O’Reilly,Jeroen Janssens,2015
Python Data Science Handbook: Essential Tools for Working with Data,O’Reilly Media,Jake VanderPlas,2016
Starting Out with Java: From Control Structures through Data Structures (What's New in Computer Science),Pearson,"Gaddis, Tony, Muganda, Godfrey",2018
Effective Data Science Infrastructure: How to make data scientists productive (MEAP v07),Manning Publications,Ville Tuulos,2022
Data Science and Analytics with Python,Chapman and Hall/CRC,Jesus Rogel-Salazar,2017
"Intro to Python for Computer Science and Data Science: Learning to Program with AI, Big Data and The Cloud",Pearson,Paul J. Deitel & Harvey M. Deitel [Paul J. Deitel],2019
Essential Math for Data Science,"O'Reilly Media, Inc.",Thomas Nield,2022
"Analytics, Data Science, & Artificial Intelligence: Systems for Decision Support (11th Edition)",Pearson,"Ramesh Sharda, Dursun Delen, Efraim Turban",2019
Data Science for Business: What you need to know about data mining and data-analytic thinking,O'Reilly Media,"Foster Provost, Tom Fawcett",2013
Machine Learning Algorithms - Popular algorithms for data science and machine learning,Packt Publishing,Giuseppe Bonaccorso,2018
"Machine Learning for Signal Processing: Data Science, Algorithms, and Computational Statistics","Oxford University Press, USA",Max A. Little,2019
An Introduction to Data Science,"SAGE Publications, Inc","Jeffrey S. Saltz, Jeffrey M. Stanton",2017
The Essentials of Data Science: Knowledge Discovery Using R,"Chapman and Hall/CRC;Chapman & Hall, Williams, Graham",Graham J. Williams,2017
Practical Data Science with Python: Learn tools and techniques from hands-on examples to extract insights from data,Packt Publishing,"George, Nathan",2021
A collection of Advanced Data Science and Machine Learning Interview Questions Solved in Python and Spark  (II): Hands-on Big Data and Machine ... Programming Interview Questions) (Volume 7),CreateSpace Independent Publishing Platform,Dr Antonio Gulli,2015
Jupyter for Data Science,Packt Publishing,Dan Toomey,2017
Data Science in Education Using R,Routledge,"Ryan A. Estrellado, Emily A. Freer",2021
"Managing Your Data Science Projects: Learn Salesmanship, Presentation, and Maintenance of Completed Models",Apress,Robert de Graaf,2019
Data Analysis and Machine Learning with Kaggle: How to win competitions on Kaggle and build a successful career in data science,Packt Publishing - ebooks Account,Konrad Banachewicz,2021
"Python: 6 Books in 1:  The Ultimate Bible to Learn Python Programming for a Career in Machine Learning, Data Science &  Web Development.",nan,"Soranson, Oliver",2020
Handbook of Computational Statistics and Data Science,Wiley,"Walter W. Piegorsch, Richard F. Levine, Hao Helen Zhang, Thomas C. M. Lee",2022
Introduction to Statistical Data Analysis for the Life Sciences,CRC Press,"Claus Thorn Ekstrøm, Helle Sørensen",2014
Business Analytics: The Science of Data-driven Decision Making,Wiley,U. Dinesh Kumar,2017
"Python Programming: The Complete Guide to Learn Python for Data Science, AI, Machine Learning, GUI and More With Practical Exercises and Interview Questions",nan,Nicholas Ayden,2019
Big Data Meets Survey Science: A Collection of Innovative Methods,Wiley,"Craig A. Hill (editor), Paul P. Biemer (editor), Trent D. Buskirk (editor), Lilli Japec (editor), Antje Kirchner (editor), Stas Kolenikov (editor), Lars E. Lyberg (editor)",2021
Data Science and Data Analytics,CRC Press (Unlimited),"Amit Kumar Tyagi, ",2022
"Beginning Data Science in R: Data Analysis, Visualization, and Modelling for the Data Scientist",Apress,Thomas Mailund,2017
Practical Data Science: A Guide to Building the Technology Stack for Turning Data Lakes into Business Assets,Apress,Andreas François Vermeulen,2018
Data Science Solutions on Azure: Tools and Techniques Using Databricks and MLOps,Apress,"Julian Soh, Priyanshi Singh",2020
Data Science for Healthcare: Methodologies and Applications,Springer International Publishing,"Sergio Consoli, Diego Reforgiato Recupero, Milan Petković",2019
Julia for Data Science,Technics Publications,Zacharias Voulgaris PhD [Zacharias Voulgaris PhD],2016
Data Science Essentials in Python: Collect - Organize - Explore - Predict - Value,Pragmatic Bookshelf,Dmitry Zinoviev,2016
Model-Based Clustering and Classification for Data Science: With Applications in R,Cambridge University Press,"Charles Bouveyron, Gilles Celeux, T. Brendan Murphy, Adrian E. Raftery",2019
"Python Data Analytics: Data Analysis and Science Using Pandas, matplotlib, and the Python Programming Language",Apress,Fabio Nelli (auth.),2015
"Data Science Solutions with Python: Fast and Scalable Models Using Keras, PySpark MLlib, H2O, XGBoost, and Scikit-Learn",Apress,Tshepo Chris Nokeri,2021
Process Mining: Data Science in Action,Springer-Verlag Berlin Heidelberg,Wil van der Aalst (auth.),2016
Data Science For Dummies,For Dummies,Lillian Pierson,2021
Data Science from Scratch: First Principles with Python,O'Reilly Media,Joel Grus,2019
"Data Science con Python - Dalle stringhe al machine learning, le tecniche essenziali per lavorare sui dati",Apogeo,Dmitry Zinoviev,2016
Data Science and Classification,Springer,"Vladimir Batagelj, Hans-Hermann Bock, Anuka Ferligoj, Ale iberna",2006
"Marketing Analytics: Optimize Your Business with Data Science in R, Python, and SQL",nan,"Jacobs, Dave",2016
Fundamentals of Data Structures in C,Computer Science Press,"Ellis Horowitz, Sartaj Sahni, Susan Anderson-Freed",1993
Managing Data Science: Effective Strategies To Manage Data Science Projects And Build A Sustainable Team,Packt Publishing,Kirill Dubovikov,2019
Data Visualization Guide: Clear Guide to Data Science and Visualization,nan,"Campbell, Alex [Campbell, Alex]",2021
"Beginning Data Science With Python and Jupyter: Use Powerful Industry-Standard Tools Within Jupyter and the Python Ecosystem to Unlock New, Actionable Insights From Your Data",Packt Publishing,"Alex Galea [Galea, Alex]",2018
"Functional Programming in R: Advanced Statistical Programming for Data Science, Analysis and Finance",Apress,Thomas Mailund,2017
Experimental Methods For Science And Engineering Students: An Introduction To The Analysis And Presentation Of Data,Cambridge University Press,Les Kirkup,2019
Data Science. Наука о данных с нуля,БХВ-Петербург,Джоэл Грас,2021
"Business Intelligence, Analytics, and Data Science: A Managerial Perspective",Pearson,"Ramesh Sharda, Dursun Delen, Efraim Turban",2017
The Data Science Handbook,leanpub.com,"Carl Shan, Henry Wang, William Chen, Max Song",2015
Data Science For Dummies,John Wiley & Sons,Lillian Pierson,2015
Executive Data Science: A Guide To Training And Managing The Best Data Scientists,lulu.com,"Brian Caffo, Roger D. Peng, Jeffrey T. Leek",2018
"Data Science Projects with Python, Second Edition",Packt Publishing,Stephen Klosterman,2021
"Data, models, and decisions: the fundamentals of management science",South-Western College Pub.,"Dimitris Bertsimas, Robert Michael Freund",2000
Supervised and Unsupervised Learning for Data Science,Springer International Publishing,"Michael W. Berry, Azlinah Mohamed, Bee Wah Yap",2020
"The Python Bible 7 in 1: Volumes One To Seven (Beginner, Intermediate, Data Science, Machine Learning, Finance, Neural Networks, Computer Vision)",nan,"Dedov, Florian",2020
Introduction to Data Science Data Analysis and Prediction Algorithms with R,CRC Press,Rafael A. Irizarry,2019
Python: 3 books in 1 : Python basics for Beginners + Python Automation Techniques And Web Scraping + Python For Data Science And Machine Learning,nan,"Vickler, Andy",2021
Data Science for Business and Decision Making,Academic Press,"Luiz Paulo Fávero, Patrícia Belfiore",2019
Introduction to Quantitative Data Analysis in the Behavioral and Social Sciences,John Wiley & Sons,Michael J. Albers,2017
Statistical Inference for Data Science - A Companion to the Coursera Statistical Inference Course,nan,Brian Caffo,2015
"Analytics, data science, & artificial intelligence : systems for decision support",Pearson,"Dursun Delen, Ramesh Sharda, Efraim Turban",2020
Data Science with SQL Server Quick Start Guide,Packt Publishing,Dejan Sarka,2018
"Big Data: Concepts, Warehousing, and Analytics (River Publishers Series in Information Science and Technology)",River Publishers,"Maribel Yasmina Santos, Carlos Costa",2020
Data Science with Java: Practical Methods for Scientists and Engineers,O’Reilly Media,Michael R. Brzustowicz,2017
Practical Data Science Cookbook: 89 hands-on recipes to help you complete real-world data science projects in R and Python,Packt Publishing,"Tony Ojeda, Sean Patrick Murphy, Benjamin Bengfort, Abhijit Dasgupta",2014
Data Reduction and Error Analysis for the Physical Sciences,McGraw-Hill Science/Engineering/Math,"Philip Bevington, D. Keith Robinson",2002
"Data Science mit Python: Das Handbuch für den Einsatz von IPython, Jupyter, NumPy, Pandas, Matplotlib und Scikit-Learn",MITP-Verlags,Jake VanderPlas,2017
Hands-on data science for marketing: improve your marketing strategies with machine learning using Python and R,Packt Publishing,"Hwang, Yoon Hyup",2019
"Advanced Object-Oriented Programming in R: Statistical Programming for Data Science, Analysis and Finance",Apress,Thomas Mailund,2017
Hands-On Data Science with R: Techniques to perform data manipulation and mining to build smart analytical models using R,Packt Publishing,"Vitor Bianchi Lanzetta, Nataraj DasGupta, Ricardo Anjoleto Farias",2018
Python for Data Science: A Hands-On Introduction,No Starch Press,Yuli Vasiliev,2022
"R for Data Science: Import, Tidy, Transform, Visualize, and Model Data",O’Reilly Media,"Hadley Wickham, Garrett Grolemund",2017
The Enterprise Big Data Lake: Delivering the Promise of Big Data and Data Science,O'Reilly Media,Alex Gorelik,2019
"Machine Learning and Data Science in the Oil and Gas Industry: Best Practices, Tools, and Case Studies",Gulf Professional Publishing,Patrick Bangert,2021
The Python Workshop: Learn to code in Python and kickstart your career in software development or data science,Packt Publishing,"Andrew Bird, Dr Lau Cher Han, Mario Corchero Jimenez, Graham Lee, Corey Wade",2019
Foundational Python for Data Science,Addison-Wesley Professional,Kennedy Behrman,2021
"Python for Beginners: Start Right Now to Learn Computer Programming with the Best Crash Course. Improve your Skills with Machine Learning, Data Analysis and Data Science",nan,"Chan, Ben",2020
"Python Data Science Essentials - Third Edition: A Beginner’s Guide Covering Essential Data Science Principles, Tools, and Techniques",Packt Publishing,Luca Massaron & Alberto Boschetti [Luca Massaron],2018
Network Science with Python and NetworkX Quick Start Guide: Explore and visualize network data effectively,Packt Publishing,Edward L. Platt,2019
"ARTIFICIAL INTELLIGENCE BUSINESS APPLICATIONS: How to Learn Applied Artificial Intelligence and Use Data Science for Business. Includes Data Analytics, Machine Learning for Business and Python",nan,"FORD, WILLIAM J.",2020
Data Science from Scratch with Python: Step-by-Step Guide,nan,"Peter Morgan [Morgan, Peter]",2018
Data Science with Python and Dask,Manning Publications,Jesse C. Daniel,2019
"Machine Learning- The Mastery Bible: The definitive guide to Machine Learning, Data Science, Artificial Intelligence, Neural Networks, and Data Analytics.",nan,"Hanson, Bill",2020
Data Science do zero: Primeiras regras com o Python,Alta Books,Joel Grus,2016
Machine Learning in Production: Developing and Optimizing Data Science Workflows and Applications,Addison-Wesley,"Andrew Kelleher, Adam Kelleher",2019
"Big Data, Cloud Computing, and Data Science Engineering",Springer International Publishing,Roger Lee,2020
Agile Data Science 2.0: Building Full-Stack Data Analytics Applications with Spark,O’Reilly Media,Russell Jurney,2017
Data science using Python and R,John Wiley & Sons,"Larose, Chantal D., Larose, Daniel T",2019
Основы Data Science и Big Data. Python и наука о данных,Питер,"Дэви Силен, Арно Мейсман",2017
Data Science and Predictive Analytics: Biomedical and Health Applications using R,Springer International Publishing,Ivo D. Dinov,2018
Unsupervised Deep Learning in Python: Master Data Science and Machine Learning with Modern Neural Networks written in Python and Theano,LazyProgrammer,LazyProgrammer,2016
Using R For Data Analysis In Social Sciences: A Research Project-oriented Approach,Oxford University Press,"Li, Quan",2019
"Becoming a Data Head: How to Think, Speak, and Understand Data Science, Statistics, and Machine Learning",Wiley,"Alex J. Gutman, Jordan Goldmeier",2021
Python Data Science: After work guide to start learning Data Science on your own. Avoid common beginners mistakes of coding. Approach Panda and NumPy to become a brilliant computer programmer.,nan,"HOOD, CODING, Kölling, Michail",2020
Big Data Science in Finance,Wiley,"Irene Aldridge, Marco Avellaneda",2021
Data Science with Microsoft SQL Server 2016,Microsoft Press,"Buck Woody, Danielle Dean, Debraj GuhaThakurta, Gagan Bansal, Matt Conners and Wee-Hyong Tok",2016
How to Lead in Data Science,Manning Publications,"Jike Chong, Yue Cathy Chang",2021
Data Science in the Cloud: with Microsoft Azure Machine Learning and R,O'Reilly Media,Stephen F. Elston,2015
PYTHON DATA SCIENCE Learn Python in a Week and Master it,nan,coll,2020
Analytical Skills for AI and Data Science: Building Skills for an AI-Driven Enterprise,"O'Reilly Media, Inc, USA",Daniel Vaughan,2020
Python for Beginners: The Crash Course to Learn Python Programming in 3-Days (or less). Master Artificial Intelligence for Data Science and Machine Learning + Practical Exercises,nan,"Khan, Aaron",2020
Data Science and Digital Transformation in the Fourth Industrial Revolution,Springer International Publishing,"Jongbae Kim, Roger Lee",2021
"Data Science Algorithms in a Week: Top 7 algorithms for computing, data analysis, and machine learning",Packt Publishing,David Natingga,2017
Essential Math for Data Science (Third Early Release),"O’Reilly Media, Inc.",Thomas Nield,2021
"Python for Data Science: The Ultimate Step-by-Step Guide to Learn Python In 7 Days & NLP, Data Science from with Python (Master The basics of Data Science and Improve Artificial Intelligence)",nan,"Wilson, Richard",2021
Financial Analytics with R. Building a Laptop Laboratory for Data Science,Cambridge,"Mark J. Bennett, Dirk L. Hugen",2016
Advanced Binary for Programming and Computer Science Logical Bitwise and Arithmetic Operations and Data Encoding and Representation,Answers 2000 Limited,Sunil Tanna,2018
IPython Interactive Computing and Visualization Cookbook: Over 100 hands-on recipes to sharpen your skills in high-performance numerical computing and data science with Python,Packt Publishing,Cyrille Rossant,2014
Data Science for Business Professionals,BPB Publications,Probyto Data Science and Consulting Pvt. Ltd. [Probyto Data Science and Consulting Pvt. Ltd.],2020
Data Science,The MIT Press,"John D. Kelleher, Brendan Tierney",2018
Journal of Financial Data Science,IPR Journals,Marco Lopez de Prado,2019
"Graph Data Science (GDS) For Dummies®, Neo4j Special Edition","John Wiley & Sons, Inc ","Amy Hodler, Mark Needham",2020
Introduction to Machine Learning with Python: A Guide for Beginners in Data Science,AI Sciences LLC,"Daniel Nedal, Peters Morgan",2018
Mathematical Foundations of Data Science Using R,de Gruyter,"Frank Emmert-Streib, Salissou Moutari, Matthias Dehmer",2020
"Python for Data Science: 2 Books in 1. A Practical Beginner’s Guide to learn Python Programming, introducing into Data Analytics, Machine Learning, Web Development, with Hands-on Projects",nan,"THOMPSON, ERICK",2020
"JupyterLab Quick Start Guide: A beginner's guide to the next-gen, web-based interactive computing environment for data science",Packt Publishing,"Lindsay Richman, Melissa Ferrari, Joseph Oladokun, Wesley Banfield, Dan Toomey",2019
Football Hackers: The Science and Art of a Data Revolution,Blink Publishing / Bonnier Books,Christoph Biermann,2019
"Data Science on AWS: Implementing End-to-End, Continuous AI and Machine Learning Pipelines",O'Reilly Media,"Chris Fregly, Antje Barth",2021
Python for Data Science For Dummies,Wiley,"John Paul Mueller, Luca Massaron",2015
"Essentials of Data Science and Analytics: Statistical Tools, Machine Learning, and R-Statistical Software Overview",Business Expert Press,Sahay. Amar (author),2021
"Python for Data Analysis: A Complete Guide for Beginners, Including Python Statistics and Big Data Analysis.",nan,Computer Science Academy,2020
"Metaprogramming in R: Advanced Statistical Programming for Data Science, Analysis and Finance",Apress,Thomas Mailund,2017
Quantitative Economics With R: A Data Science Approach,Springer,Vikram Dayal,2020
Data analysis for the life sciences with R,Chapman and Hall/CRC,"Irizarry, Rafael A., Love, Michael I",2017
Data Science for IoT Engineers: A Systems Analytics Approach,Mercury Learning and Information,"Madhavan Ph.D., P. G.",2022
"Python for Beginners: Comprehensive Guide to the Basics of Programming, Machine Learning, Data Science and Analysis with Python.",nan,"Campbell, Alex",2021
"It's All Analytics!: The Foundations of Al, Big Data and Data Science Landscape for Professionals in Healthcare, Business, and Government",Productivity Press,"Scott Burk, Gary D. Miner",2020
"Data Science on the Google Cloud Platform, 2nd Edition (Third Early Release)","O'Reilly Media, Inc.",Valliappa Lakshmanan,2022
"Jupyter for Data Science: Exploratory analysis, statistical modeling, machine learning, and data visualization with Jupyter",Packt Publishing,Dan Toomey,2017
Data Science Crash Course for Beginners: Fundamentals and Practices with Python,AI Publishing,AI Publishing,2020
Apache Spark 2.x Cookbook: Cloud-ready recipes for analytics and data science,Packt Publishing,Rishi Yadav,2017
Beginning Java Data Structures and Algorithms: Sharpen your problem solving skills by learning core computer science concepts in a pain-free manner,Packt Publishing,James Cutajar,2018
"ProgrammerLazy. SQL for Marketers: Dominate data analytics, data science, and big data. Data Science and Machine Learning in Python",nan,,english
Report Writing for Data Science in R,nan,Roger D. Peng,2015
Data Science Foundations: Geometry and Topology of Complex Hierarchic Systems and Big Data Analytics,Chapman and Hall/CRC,Fionn Murtagh,2017
"Python Data Science Handbook, 2nd Edition (Second Early Release)","O'Reilly Media, Inc.",Jake VanderPlas,2022
Machine Learning in Business - An Introduction to the World of Data Science,Independently published,John Hull,2020
Applied Missing Data Analysis (Methodology In The Social Sciences),nan,Craig K. Enders PhD,2010
Data Communications and Networking,McGraw-Hill Science/Engineering/Math,"Behrouz A Forouzan, Behrouz Forouzan",2003
Nature Inspired Computing for Data Science,Springer,"Minakhi Rout, Jitendra Kumar Rout, Himansu Das (Editors)",2020
Arduino Measurements in Science: Advanced Techniques and Data Projects,Apress,Richard J. Smythe,2021
Data Science in Theory and Practice: Techniques for Big Data Analytics and Complex Data Sets,Wiley,"Mariani, Maria C., Tweneboah, Osei Kofi, Beccar-Varela, Maria Pia",2021
"Data Science from Scratch: The #1 Data Science Guide for Everything A Data Scientist Needs to Know: Python, Linear Algebra, Statistics, Coding, Applications, Neural Networks, and Decision Tree",nan,Cooper Steven,2018
Advances in Data Science: Methodologies and Applications,Springer Internationa,"Gloria Phillips-Wren, Anna Esposito, Lakhmi C. Jain",2021
Introduction to HPC with MPI for Data Science,Springer International Publishing,Frank Nielsen,2016
Data Science on the Google Cloud Platform: Implementing End-to-End Real-Time Data Pipelines: From Ingest to Machine Learning,O'Reilly Media,Valliappa Lakshmanan,2022
The Big Book of Data Science Use Cases,nan,Databricks,2020
Econometrics and Data Science: Apply Data Science Techniques to Model Complex Problems and Implement Solutions,Apress,Tshepo Chris Nokeri,2021
Data Science : Innovative Developments in Data Analysis and Clustering,Springer International Publishing,"Francesco Palumbo, Angela Montanari, Maurizio Vichi (eds.)",2017
Build a Career in Data Science,Manning Publications,"Jacqueline Nolis, Emily Robinson",2020
Python for R users : a data science approach,Wiley,"Ohri, Ajay",2018
Fast Python for Data Science Version 8,Manning Publications,Tiago Rodrigues Antao [Tiago Antão],2022
Productive and Efficient Data Science with Python,Apress,Tirthajyoti Sarkar,2022
Geospatial Data Science Techniques and Applications,CRC Press,"Hassan A. Karimi, Bobak Karimi",2018
"Python Machine Learning: The Ultimate Guide for Beginners to Machine Learning with Python, Programming and Deep Learning, Artificial Intelligence, Neural Networks, and Data Science",nan,"Moore, Richard, Moore, Richard",2019
Basketball Data Science: With Applications in R,CRC Press,"Paola Zuccolotto, Marica Manisera",2020
"Programming for Beginners: 3 Manuscripts: The Complete Guide to Learning Python Crash Course, Python Machine Learning and Python Data Science in a Week",nan,"Lee, Andrew",2021
Audit Analytics: Data Science for the Accounting Profession,Springer International Publishing;Springer,J. Christopher Westland,2020
Statistical Inference via Data Science: A ModernDive into R and the Tidyverse (Chapman & Hall/CRC The R Series),Chapman and Hall/CRC,"Chester Ismay, Albert Y. Kim",2019
Longitudinal and Panel Data: Analysis and Applications in the Social Sciences,nan,Edward W. Frees,2004
Julia for Data Science,Packt Publishing,Anshul Joshi,2016
Fundamentals of Clinical Data Science,Springer Nature,"Pieter Kubben, Michel Dumontier, Andre Dekker",2019
ML Ops: Operationalizing Data Science,"O'Reilly Media, Inc.",David Sweenor & Steven Hillion & Dan Rope & Dev Kannabiran & Thomas Hill & Michael O'Connell [David Sweenor],2020
"Big Data and Artificial Intelligence: Complete Guide to Data Science, AI, Big Data and Machine Learning.",nan,"Weber, Hans",2020
Data Science In Cybersecurity And Cyberthreat Intelligence,Springer,"Leslie F. Sikos, Kim-Kwang Raymond Choo",2020
Human-Centered Data Science: An Introduction,The MIT Press,"Aragon, Cecilia, Guha, Shion, Kogan, Marina, Muller, Michael, Neff, Gina",2022
Python Pandas for Beginners: Pandas Specialization for Data Scientist (Python for Beginners in Data Science and Data Analysis Book 2),AI Publishing LLC,"Publishing, AI",2022
"Python For Data Analysis: The Ultimate and Definitive Manual to Learn Data Science and Coding With Python. Master The basics of Machine Learning, to Clean Code and Improve Artificial Intelligence",Dario Valvo,Matt Algore,2021
Deep Learning Made Easy with R: A Gentle Introduction For Data Science,CreateSpace Independent Publishing Platform,N.D Lewis,2016
"Business Data Science: Combining Machine Learning and Economics to Optimize, Automate, and Accelerate Business Decisions",McGraw-Hill Education,Matt Taddy,2019
"Velocity-Based Training: How to Apply Science, Technology, and Data to Maximize Performance",Human Kinetics,"Signore, Nunzio",2021
PYTHON DATA SCIENCE: The Complete Step-by-Step Python Programming Guide. Learn How to Master Big Data Analysis and Machine Learning (2022 Edition For Beginners),nan,Ivor Osborne,2021
Essential Math for Data Science,O'Reilly,Thomas Nield,2022
Generalized Linear Models for Insurance Data (International Series on Actuarial Science),Cambridge University Press,"Piet de Jong, Gillian Z. Heller",2008
"Arduino in Science: Collecting, Displaying, and Manipulating Sensor Data",Apress,Richard J. Smythe,2021
Introdução a Data Science - Algoritmos de Machine Learning e métodos de análise,Casa do Código,"Tatiana Escovedo, Adriano Koshiyama",2020
Neural data science : a primer with MATLAB and Python,Academic Press,"Nylen, Erik Lee, Wallisch, Pascal",2017
Statistical Analysis Of Empirical Data: Methods For Applied Sciences,Springer,Scott Pardo,2020
Cloud Computing for Data Analysis The missing semester of Data Science,Leanpub book,Noah Gift,2021
"Big Data Analytics for Improved Accuracy, Efficiency, and Decision Making in Digital Marketing",Business Science Reference,Amandeep Singh,2021
Data Science from Scratch: First Principles with Python,O'Reilly Media,Joel Grus,2019
"Data Science in Engineering and Management: Applications, New Developments, and Future Trends",CRC Press,"Zdzislaw Polkowski (editor), Sambit Kumar Mishra (editor), Julian Vasilev (editor)",2022
Big Data in Computational Social Science and Humanities,Springer,Shu-Heng Chen,2018
Python: Real-World Data Science: A course in four modules,Packt Publishing,"Dusty Phillips, Fabrizio Romano, Phuong Vo.T.H, Martin Czygan, Robert Layton",2016
Introduction to Data Science: Essential Concepts,nan,"Peters Morgan [Morgan, Peters]",2018
"Machine Learning for Signal Processing: Data Science, Algorithms, and Computational Statistics","Oxford University Press, USA",Max A. Little,2019
"Principles of High-Performance Processor Design: For High Performance Computing, Deep Neural Networks and Data Science",Springer,Junichiro Makino,2021
