title,publisher,author,year"Building Data Science Applications with FastAPI: Develop, manage, and deploy efficient machine learning applications with Python",Packt Publishing,François Voron,2021
"Measurement and Data Analysis for Engineering and Science, Fourth Edition",CRC Press,"Patrick F Dunn, Michael P. Davis",2018
Advanced Multi-industry Applications of Big Data Clustering and Machine Learning,Engineering Science Reference,Fausto Pedro Garcia Marquez (editor),2020
Principles of Data Science: Learn the techniques and math you need to start making sense of your data,Packt Publishing,Sinan Ozdemir,2016
"Essential Math for Data Science: Take Control of Your Data with Fundamental Linear Algebra, Probability, and Statistics, First Edition",O'Reilly Media,Thomas Nield,2022
"Data analysis and statistics for geography, environmental science, and engineering",CRC Press,"Acevedo, Miguel F",2013
30-Second Data Science,Ivy Press,Liberty Vittert,2020
IPython Interactive Computing and Visualization Cookbook : Over 100 hands-on recipes to sharpen your skills in high-performance numerical computing and data science in the Jupyter Notebook,Packt Publishing Limited,Cyrille Rossant,2018
"Data Analysis Methods in Physical Oceanography, Third Edition",Elsevier Science,"Richard E. Thomson, William J. Emery",2014
Data science par la pratique: Fondamentaux avec Python,Eyrolles,Joel Grus,french
Python for Data Science For Dummies,John Wiley & Sons,"John Paul Mueller, Luca Massaron",2015
Introduction to Python in Earth Science Data Analysis From Descriptive Statistics to Machine Learning,Springer Nature Switzerland,Maurizio Petrelli,2021
97 Things About Ethics Everyone in Data Science Should Know,O'Reilly Media,Bill Franks,2020
Data Science. Наука о данных с нуля,БХВ-Петербург,Грас Джоэл,2017
The Data Engineering Cookbook: Mastering The Plumbing Of Data Science,UNKNOWN,YASSINE MOUSAIF,2022
Introduzione a Python. Per l'informatica e la data science. Ediz. MyLab. Con Contenuto digitale per accesso on line,Pearson,"Paul J. Deitel, Harvey M. Deitel, Pietro Codara (editor), Carlo Mereghetti (editor)",2021
Data Science on AWS,"O'Reilly Media, Inc.",Chris Fregly & Antje Barth [Chris Fregly],2021
A Hands-On Introduction to Data Science,Cambridge University Press,Chirag Shah,2020
Advanced Data Science and Analytics With Python,Taylor & Francis Ltd,Jesus Rogel-Salazar,2020
"Logics for Computer and Data Sciences, and Artificial Intelligence",Springer Nature,Lech T. Polkowski,2022
Managing and Visualizing Your BIM Data: Understand the fundamentals of computer science for data visualization,Packt Publishing,"Ernesto Pellegrino, Manuel André Bottiglieri, Gavin Crump, Luisa Cypriano Pieper, Dounia Tou",2021
Fast Python for Data Science (MEAP V03),Manning Publications,Tiago Rodrigues Antão,2021
Data Science Para Leigos,nan,Lillian Pierson,2019
Data Science with Raspberry Pi: Real-Time Applications Using a Localized Cloud,Apress,"Abdul Kadhar, K. Mohaideen, Anand, G.",2021
Data Science Algorithms in a Week - Second Edition,Packt Publishing,David Natingga [David Natingga],2018
Python Data Science: An Ultimate Guide for Beginners to Learn Fundamentals of Data Science Using Python,nan,Christopher  Wilkinson,2020
The Big R-Book: From Data Science to Learning Machines and Big Data,Wiley,Philippe J. S. De Brouwer,2020
500 Most Important Data Science Interview Questions and Answers: Crack That Next Interview With Higher Salary In Less Preparation Time,The Indian Wolf Publications,"Vamsee Puligadda [Puligadda, Vamsee]",2019
IBM SPSS Essentials: Managing and Analyzing Social Sciences Data,Wiley,John T. Kulas,2021
Building an Effective Data Science Practice: A Framework to Bootstrap and Manage a Successful Data Science Practice,Apress,"Vineet Raina, Srinath Krishnamurthy",2021
"Data Science Projects with Python: A case study approach to successful data science projects using Python, pandas, and scikit-learn",Packt Publishing,Stephen Klosterman,2019
"Statistics for data science: leverage the power of statistics for data analysis, classification, regression, machine learning, and neural networks",Packt,"Miller, James D",2017
"Python Machine Learning: The Crash Course for Beginners to Programming and Deep Learning, Artificial Intelligence, Neural Networks and Data Science. Scikit Learn, Tensorflow, Pandas and Numpy.",nan,"Smith, Django",2019
Data Science for Supply Chain Forecasting,De Gruyter,Nicolas Vandeput,2021
The Big Book of Python for Data Analysis: Learn Data Science and Coding With Python: Python Book,Independently published,"Indira Cavagnaro [Cavagnaro, Indira]",2021
Communicating with Data: The Art of Writing for Data Science,OUP Oxford,"Nolan, Deborah, Stoudt, Sara",2021
XML and Web Technologies for Data Sciences with R,Springer-Verlag New York,"Deborah Nolan, Duncan Temple Lang (auth.)",2014
"Learn Computer Science with Swift: Computation Concepts, Programming Paradigms, Data Management, and Modern Component Architectures with Swift and Playgrounds",Apress,Jesse Feiler,2018
Numsense! Data Science for the Layman (No Math Added),nan,Annalyn Ng and Kenneth Soo,2017
Building Data Science Solutions with Anaconda: A comprehensive starter guide to building robust and complete models,nan,DAN. MEADOR,2022
Fundamentals of Data Science,Chapman and Hall/CRC,"Sanjeev J. Wagh, Manisha S. Bhende, Anuradha D. Thakare",2021
Chemometrics : data driven extraction for science,John Wiley & Sons,"Brereton, Richard G",2018
The Art of Data Science: A Guide for Anyone Who Works with Data,nan,Roger D. Peng & Elizabeth Matsui,english
"Python project for beginners: Python at your fingertips! Learn, create, experiment, and don't miss the current programming language. Introduction to data science, coding, and analysis.",nan,"Chamberlin, Eric",2020
"Data Science in Chemistry: Artificial Intelligence, Big Data, Chemometrics and Quantum Computing with Jupyter",De Gruyter,Thorsten Gressling,2020
Data Science: guida ai principi e alle tecniche base della scienza dei dati,Apogeo,Sinan Ozdemir,2017
Agile data science: building data analytics applications with Hadoop,O'Reilly Media,Russell Jurney,2013
"Data Science: Theory, Algorithms, and Applications (Transactions on Computer Systems and Networks)",Springer,"Gyanendra K. Verma (editor), Badal Soni (editor), Salah Bourennane (editor), Alexandre C. B. Ramos (editor)",2021
"Beginning Data Science, IoT, and AI on Single Board Computers: Core Skills and Real-World Application with the BBC micro:bit and XinaBox",Apress,"Philip Meitiner, Pradeeka Seneviratne",2020
"Data Science on AWS: Implementing End-to-End, Continuous AI and Machine Learning Pipelines",O'Reilly Media,"Chris Fregly, Antje Barth",2021
Data Science and Digital Business,Springer International Publishing,"Fausto Pedro García Márquez, Benjamin Lev",2019
Data Science: Create Teams That Ask the Right Questions and Deliver Real Value,Apress,Doug Rose (auth.),2016
Python Programming: Learn the Basics and get into Data Science,nan,T.L.John,2021
"Python for Beginners: The Absolute Beginners Guide to Python Programming, Data Science and Predictive Model. A Practical Introduction to Object Oriented Programming Language",nan,Django Smith,2019
Regression Models for Data Science in R: Statistical inference for data science.,UNKNOWN,"MOUSAIF, YASSINE",2022
"Artificial Intelligence, Machine Learning, and Data Science Technologies: Future Impact and Well-Being for Society 5.0 (Demystifying Technologies for Computational Excellence)",CRC Press,", , , ",2021
Physics of Data Science and Machine Learning,CRC Press,"Rauf, Ijaz A.",2021
Effective Data Science Infrastructure,Manning Publications,Ville Tuulos,2022
Python Data Science Essentials,Packt Publishing,"Alberto Boschetti, Luca Massaron",2018
"Data Science: The Ultimate Guide to Data Analytics, Data Mining, Data Warehousing, Data Visualization, Regression Analysis, Database Querying, Big Data for Business and Machine Learning for Beginners",nan,"Herbert Jones [Jones, Herbert]",2018
"PYTHON PROGRAMMING: 3 MANUSCRIPTS CRASH COURSE CODING WITH PYTHON DATA SCIENCE. THE STEP BY STEP GUIDE FOR BEGINNERS TO MASTER SOFTWARE PROJECTS, ALGORITHMS, TRICKS AND TIPS",nan,"Tacke, John, Matthes, Adrienne Hawke",2020
Data Science – was ist das eigentlich?!: Algorithmen des maschinellen Lernens verständlich erklärt,Springer Berlin Heidelberg,"Annalyn Ng, Kenneth Soo",2018
The Field Guide to Data Science: 2nd Edition,UNKNOWN,"MOUSAIF, YASSINE",2022
Quantitative Methods of Data Analysis for the Physical Sciences and Engineering,Cambridge University Press,Douglas G. Martinson,2018
R for Data Science: Learn and explore the fundamentals of data science with R,Packt Publishing,Dan Toomey,2014
Python data science handbook: essential tools for working with data,O'Reilly Media,"VanderPlas, Jacob T",2017
Big Data Science in Finance,John Wiley & Sons,Irene Aldridge and Marco Avellaneda,2020
Big Data and Social Science: Data Science Methods and Tools for Research and Practice,Chapman and Hall/CRC,"Ian Foster (editor), Rayid Ghani (editor), Ron S. Jarmin (editor), Frauke Kreuter (editor), Julia Lane (editor)",2020
Python: Real-World Data Science,Packt Publishing,Sebastian Raschka & Robert Layton & Martin Czygan & Phuong Vo.T.H & Fabrizio Romano & Dusty Phillips [Sebastian Raschka],2016
Statistique et Data Science Avec R,Université Rennes 2,François Husson,2018
Data Science for Mathematicians,CRC Press,Nathan Carter,2020
R for Health Data Science,Taylor & Francis Limited,Ewen Harrison & Riinu Pius,2020
Public Policy Analytics: Code and Context for Data Science in Government,CRC Press,Ken Steif,2021
Analytical Skills for AI and Data Science: Building Skills for an AI-Driven Enterprise,O'Reilly Media,Daniel Vaughan,2020
Data science in R : a case studies approach to computational reasoning and problem solving,CRC Press,"Lang, Duncan Temple, Nolan, Deborah",2015
"It's All Analytics - Part II: Designing an Integrated AI, Analytics, and Data Science Architecture for Your Organization",Productivity Press,"Scott Burk, David Sweenor, Gary Miner",2021
"Data-Driven Science and Engineering: Machine Learning, Dynamical Systems, and Control",Cambridge University Press,J. Nathan Kutz & Steven L. Brunton,2019
Provenance in Data Science: From Data Models to Context-Aware Knowledge Graphs,Springer Nature,"Leslie F. Sikos, Oshani W. Seneviratne, Deborah L. McGuinness (editors)",2021
Quantitative Analysis for System Applications: Data Science and Analytics Tools and Techniques,Technics Publications,Daniel A. McGrath Ph.D. [Daniel A. McGrath Ph.D.],2018
"Data Science Thinking: The Next Scientific, Technological and Economic Revolution",Springer International Publishing,Longbing Cao,2018
Data Science Design manual,Springer,Stevven S Skiena,2017
Scala for Data Science,Packt Publishing,Pascal Bugnion,2016
Fundamentals of Well-Log Interpretation1. The Acquisition of Logging Data,Elsevier Science,O. Serra (Eds.),1984
Advances in Data Science: Methodologies and Applications,Springer International Publishing;Springer,"Gloria Phillips-Wren, Anna Esposito, Lakhmi C. Jain",2021
"Exploratory Data Analysis with MATLAB, Second Edition (Chapman & Hall CRC Computer Science & Data Analysis)",CRC Press,"Wendy L. Martinez, Angel Martinez, Jeffrey Solka",2010
Research Data Access And Management In Modern Libraries,Information Science Reference/IGI Global,"Raj Kumar Bhardwaj, Paul Banks",2019
Python for Data Science For Dummies,For Dummies,"Massaron, Luca, John Paul Mueller",2019
"Data Science at the Command Line, 2nd Edition","O'Reilly Media, Inc.",Jeroen Janssens [Jeroen Janssens],2021
Mastering Python for Data Science,Packt Publishing,Samir Madhavan,2015
Data Science for Supply Chain Forecasting,De Gruyter,Nicolas Vandeput,2021
Python NumPy for Beginners: NumPy Specialization for Data Science (Python for Beginners in Data Science and Data Analysis Book 1),AI Publishing LLC,"Publishing, AI",2022
Marketing Data Science: Modeling Techniques in Predictive Analytics with R and Python,Pearson Education,Thomas W. Miller,2015
Python data science cookbook : over 60 practical recipes to help you explore Python and its robust data science capabilities,Packt Publishing,"Subramanian, Gopi",2015
Mastering Data Analysis with R: Gain sharp insights into your data and solve real-world data science problems with R—from data munging to modeling and visualization,Packt Publishing,Gergely Daroczi,2015
"Artificial Intelligence A-Z: Learn How To Build An AI: Combine the power of Data Science, Machine Learning and Deep Learning to create powerful AI for Real-World applications",nan,Nileriver Publications,2020
Product Analytics: Applied Data Science Techniques for Actionable Consumer Insights,Addison-Wesley Professional,Joanne Rodrigues-Craig [Joanne Rodrigues-Craig],2020
"Intelligent Security Systems: How Artificial Intelligence, Machine Learning and Data Science Work For and Against Computer Security",Wiley-IEEE Press,"Reznik, Leon",2021
Modern Data Science with R (Chapman & Hall/CRC Texts in Statistical Science),Chapman and Hall/CRC,"Benjamin S. Baumer, Daniel T. Kaplan, Nicholas J. Horton",2021
Text Mining for Qualitative Data Analysis in the Social Sciences: A Study on Democratic Discourse in Germany,Springer Fachmedien Wiesbaden,Gregor Wiedemann (auth.),2016
"Big data: concepts, methodologies, tools, and applications","IGI Global,Information Science Reference",Khosrow-Pour M.  et al. (eds.),2016
"Python Programming: The Crash Course for Python Projects – Learn the Secrets of Machine Learning, Data Science Analysis and Artificial Intelligence. Introduction to Deep Learning for Beginners",nan,Sivakumar  Munusami,2019
"Data Science on the Google Cloud Platform: Implementing End-to-End Real-Time Data Pipelines, 2nd Edition",O'Reilly Media,Valliappa Lakshmanan,2022
Statistics: The Art and Science of Learning from Data,Pearson,"Alan Agresti, Christine Franklin",2012
Data structures and algorithms with C,Alpha Science International,"Pal, Debdutta, Halder, Suman",2018
Python pour la Data science Pour les Nuls,First Interactive,"John Paul MUELLER, Luca Massaron",2019
"Data Analytics: Practical Guide to Leveraging the Power of Algorithms, Data Science, Data Mining, Statistics, Big Data, and Predictive Analysis to Improve Business, Work, and Life",nan,Arthur Zhang,2017
Mathematical methods for knowledge discovery and data mining,Information Science Reference,"Giovanni Felici, Giovanni Felici, Carlo Vercellis",2008
Analytical Skills for AI and Data Science,O'Reilly Media,Daniel Vaughan,2020
Secure Data Science: Integrating Cyber Security and Data Science,nan,"Bhavani Thuraisngham, Murat Kantarcioglu, and Latifur Khan",2022
"Data Science at the Command Line: Obtain, Scrub, Explore, and Model Data with Unix Power Tools","O'Reilly Media, Inc, USA",Jeroen Janssens,2021
Introduction to Statistical and Machine Learning Methods for Data Science,SAS Institute,Carlos Reis Pinheiro & Mike Patetta,2021
Simulation for Data Science with R,Packt,Matthias Templ,2016
Python Data Science Essentials - Second Edition,Packt Publishing - ebooks Account,"Alberto Boschetti, Luca Massaron",2016
Jupyter for Data Science,Packt Publishing,Dan Toomey,2017
"Programming for Beginners: 3 Manuscripts: The Complete Guide to Learning Python Crash Course, Python Machine Learning and Python Data Science in a Week",nan,"Lee, Andrew [Lee, Andrew]",2021
"scikit-learn Cookbook: Over 50 recipes to incorporate scikit-learn into every step of the data science pipeline, from feature extraction to model building and model evaluation",Packt Publishing,Trent Hauck,2014
"Java Programming Box Set: Programming, Master's Handbook & Artificial Intelligence Made Easy; Code, Data Science, Automation, problem solving, Data Structures & Algorithms",nan,Code Well Academy.,english
"Machine Learning and Data Science in the Power Generation Industry: Best Practices, Tools, and Case Studies",Elsevier,Patrick Bangert (ed.),2021
DATA SCIENCE FROM SCRATCH: From Data Visualization To Manipulation. It Is The Easy Way! All You Need For Business Using The Basic Principles Of Python And Beyond  [REVISED & EXPANDED EDITION],nan,WILLIAM GRAY,english
"Data Science and Social Research II: Methods, Technologies and Applications",Springer International Publishing;Springer,"Paolo Mariani, Mariangela Zenga",2021
